{
 "subject": {
  "kind": "image",
  "id": "hzumfsms",
  "batch": "Batch_3",
  "n_images": 1
 },
 "verdict": {
  "label": "outside_bounds",
  "rule": "RULEBOOK S2: two independent families each |z| > 3 vs Batch_3, not confounded, acquisition balanced",
  "closed_set": {
   "predicted_batch": "Batch_3",
   "confidence": 0.9902757338424308,
   "note": "family acquisition; assumes the image is from one of the known batches"
  },
  "open_set": {
   "nearest_batch": "Batch_3",
   "distance_to_each_batch": {
    "Batch_1": 35.23397772271162,
    "Batch_2": 10.791802235497576,
    "Batch_3": 1.2461149390512505
   },
   "null_band_95": 0.05,
   "matches_known_batch": true
  }
 },
 "acquisition": {
  "covariates": {
   "noise_sigma": {
    "value": 30.96353076923077,
    "training_p05": 30.003642307692306,
    "training_p95": 44.741731730769224,
    "flag": false
   },
   "sharpness": {
    "value": 1092.031407246223,
    "training_p05": 1010.2698157628377,
    "training_p95": 2207.609102010727,
    "flag": false
   },
   "curtaining_score": {
    "value": 0.026573548467212445,
    "training_p05": 0.020836496963073367,
    "training_p95": 0.02689641123509152,
    "flag": false
   },
   "hstripe_score": {
    "value": 0.04336354974984921,
    "training_p05": 0.03394241058458475,
    "training_p95": 0.04369305884139411,
    "flag": false
   },
   "edge_charging_inlens": {
    "value": -3.6509257296360627,
    "training_p05": -2.8856652555582647,
    "training_p95": 2.799724316037394,
    "flag": true
   },
   "mean_grey": {
    "value": 56.89617523780236,
    "training_p05": 54.295962003561165,
    "training_p95": 64.54878140107179,
    "flag": false
   }
  },
  "acquisition_drift_suspected": false,
  "detectors_present": [
   "BSE",
   "ETD",
   "Inlens"
  ],
  "pixel_size_confirmed": false
 },
 "evidence": {
  "drivers": [
   {
    "name": "F10_c0_fraction_iqr_512px",
    "units": "robust z vs Batch_3 (MAD)",
    "value": 8.28329249888367,
    "reference_median": 0.0,
    "effect_size": 8.28329249888367,
    "direction": "higher",
    "threshold_sensitivity": 0.005289077758789
   },
   {
    "name": "F01_c0_area_fraction",
    "units": "robust z vs Batch_3 (MAD)",
    "value": 4.903485247356198,
    "reference_median": 0.0,
    "effect_size": 4.903485247356198,
    "direction": "higher",
    "threshold_sensitivity": 0.0146814085949482
   },
   {
    "name": "F08_c0_local_thickness_median_px",
    "units": "robust z vs Batch_3 (MAD)",
    "value": 4.270661244251236,
    "reference_median": 0.0,
    "effect_size": 4.270661244251236,
    "direction": "higher",
    "threshold_sensitivity": 1.9092788696289065
   },
   {
    "name": "F03_c2_eqdiam_median_px",
    "units": "robust z vs Batch_3 (MAD)",
    "value": -3.2599778336863454,
    "reference_median": 0.0,
    "effect_size": -3.2599778336863454,
    "direction": "lower",
    "threshold_sensitivity": 0.7224620212515713
   },
   {
    "name": "F11_c2_perimeter_fraction_adjacent_c0",
    "units": "robust z vs Batch_3 (MAD)",
    "value": 2.2889544665587587,
    "reference_median": 0.0,
    "effect_size": 2.2889544665587587,
    "direction": "higher",
    "threshold_sensitivity": 0.0002820661493899
   }
  ],
  "lines_fired": {
   "class-0 geometry": [
    "F01_c0_area_fraction",
    "F08_c0_local_thickness_median_px",
    "F10_c0_fraction_iqr_512px"
   ],
   "class-2 statistics": [
    "F03_c2_eqdiam_median_px"
   ]
  }
 },
 "uncertainty": {
  "sampling": "n = 1 image; reference n = 16 Batch_3 images, leave-self-out",
  "segmentation": "threshold sensitivity per driver in evidence.drivers",
  "decision_margin": "p vs Batch_3 LOO null = 0.438 (alpha 0.05)",
  "robustness": "closed-set prediction agreed by 5 of 6 families"
 },
 "routing": {
  "stakeholder": "powder_supplier",
  "reason": "RULEBOOK S2: two independent families each |z| > 3 vs Batch_3, not confounded, acquisition balanced"
 },
 "next_action": "outside the Batch_3 baseline on two independent families (class-0 geometry: F01_c0_area_fraction, F08_c0_local_thickness_median_px, F10_c0_fraction_iqr_512px; class-2 statistics: F03_c2_eqdiam_median_px): hold the batch, request supplier CoA / EDS, schedule a cell test; drivers: F10_c0_fraction_iqr_512px +8.3 MAD, F01_c0_area_fraction +4.9 MAD, F08_c0_local_thickness_median_px +4.3 MAD",
 "caveats": [
  "phase_identity: stated by Polaron, not image-verified (no EDS; Si vs SiOx indistinguishable)",
  "adhesion to the current collector and delamination (interface not in the field of view)",
  "electrical resistance and electrochemical performance (not image quantities)",
  "moisture, residual solvent, binder distribution (not resolvable in BSE)",
  "3D porosity, tortuosity and connectivity (2D sections only)",
  "coating thickness, edge burrs, stripes (coating edge not in frame)",
  "14 of the consultant's 22 failure modes are unobservable in this data (docs/FAILURE_MODE_MAP.md)"
 ],
 "pipeline": {
  "config_path": "configs/v1.yaml",
  "config_hash": "de199d6c8d69",
  "git_sha": "f381663",
  "timestamp_utc": "2026-10-03T20:31:13+00:00",
  "frozen": false,
  "exploratory": true,
  "model_revisions": {
   "closed_set_family": "acquisition"
  }
 }
}
